{
  "schema_version": 1,
  "record_type": "ctx.handoff",
  "handoff_id": "01ARZ3NDEKTSV4RRFFQ69G5FAY",
  "task_id": "01ARZ3NDEKTSV4RRFFQ69G5FAV",
  "checkpoint_id": "01ARZ3NDEKTSV4RRFFQ69G5FAW",
  "checkpoint_digest": "sha256:05b4e564c6dd58c0bf2c44284e3d28cac303d6a4678b08b9d35b24c5aa27c285",
  "generated_at": "2026-08-03T06:06:00Z",
  "producer": {
    "actor_type": "cli",
    "system": "ctx.cli",
    "version": "0.1.0",
    "device_id": "personal-macbook",
    "extensions": {}
  },
  "target": {
    "system": "com.openai.codex",
    "interface": "desktop"
  },
  "render_profile": "ctx-handoff-markdown-v1",
  "rendered_body_digest": "sha256:eb53a863c21b0edc4392a2090bf16a2990c22d0ada44155813f1de484fdfd528",
  "extensions": {}
}
